[
  {
    "id": "c-17-airlift-aircraft",
    "name": "C-17 Globemaster III (representative airlift aircraft)",
    "type": "Aircraft",
    "description": "Represents the tasked C-17 sortie's airframe as a node in the mission execution interaction network. Deliberately generic — no specific tail number, avionics, or classified capability detail; only the public, unclassified mission profile (tactical airlift and airdrop) is represented.",
    "doctrineSource": [
      {
        "publication": "C-17 Globemaster III Air Force Fact Sheet",
        "url": "https://www.af.mil/About-Us/Fact-Sheets/Display/Article/1529726/c-17-globemaster-iii/",
        "note": "Content (mission: rapid strategic delivery of troops/cargo, capable of tactical airlift and airdrop missions) confirmed via web search on 2026-09-07; the af.mil page itself could not be directly fetched from this session's environment (network-level 403 on all .mil domains, not content-specific — see air-traffic-controller role's doctrineSource note for the same constraint)."
      }
    ]
  },
  {
    "id": "tactical-communications-system",
    "name": "Tactical Communications System (representative)",
    "type": "Communications",
    "description": "Represents the voice/data communications means used by aircrew, ATC, and ground drop-zone personnel to coordinate during mission execution. Generic and representative only — no real radio system, frequency, or crypto detail is modeled, consistent with the classification boundary (AGENTS.md Section 3).",
    "commsLink": {
      "mode": "Verbal",
      "medium": "UHF/VHF AM air-to-ground voice radio net"
    },
    "doctrineSource": [
      {
        "publication": "AFDP 3-0.1",
        "note": "Command and Control doctrine establishes that C2 depends on communications connectivity between echelons; this record represents that general concept at the execution level, not a specific real communications system. Air traffic control and aircrew-to-ground tactical coordination is voice radio by well-established, unclassified convention (ICAO/FAA and military ATC doctrine alike) — the commsLink.mode/medium reflect that general, not-mission-specific fact, not a new citation."
      }
    ]
  },
  {
    "id": "dz-safety-of-flight-radio-net",
    "name": "Drop Zone Safety-of-Flight Radio Net (UHF/VHF voice)",
    "type": "Communications",
    "description": "The voice radio channel between the Drop Zone Support Team and the drop aircraft. Deliberately limited-traffic by doctrine, not general coordination chatter: used for safety-of-flight matters (ATC directions, range clearance, unsafe surface conditions, mission changes) and to pass surface wind/limited weather observations. Mandatory for IMC/AWADS (instrument) drops; for standard visual drops, radio contact is used as needed rather than continuously. Represents a class of man-portable UHF/VHF AM radio (e.g. PRC-113-class equipment) generically — no specific real radio's exact frequency or crypto detail is modeled, consistent with the classification boundary (AGENTS.md Section 3).",
    "commsLink": {
      "mode": "Verbal",
      "medium": "UHF/VHF AM voice radio (representative class, e.g. PRC-113-class man-portable equipment), line-of-sight air-to-ground"
    },
    "doctrineSource": [
      {
        "publication": "FM 57-38, Chapter 6, Drop Zones",
        "url": "https://www.globalsecurity.org/military/library/policy/army/fm/57-38/Ch6.htm",
        "note": "Army field manual, publicly mirrored on globalsecurity.org. Confirmed via web search on 2026-09-07 that: radio contact with the drop aircraft is limited to safety-of-flight requirements or issues affecting airborne force employment; the DZST passes surface wind/limited weather observations to inbound aircraft when radio contact is made; radio contact is mandatory for IMC/AWADS operations. Direct fetch of the page itself returned a 403 to this session's automated request — content is corroborated via search-result synthesis rather than an independent full read, and should be re-verified against the primary source before treating any additional specific claim from it as fact. commsLink is this dataset's structuring of the same 'UHF/VHF voice radio' fact already in this record's name/description, not a new claim."
      }
    ]
  },
  {
    "id": "digital-situational-awareness-system",
    "name": "Digital Situational Awareness System (ATAK-class, representative)",
    "type": "Communications",
    "description": "Represents a modern geospatial/situational-awareness capability in the style of ATAK (Android Team Awareness Kit) — a real, unclassified-discussable, DoD-adopted Android application (originally developed by the Air Force Research Laboratory) used for sharing positions, markers, and zone data via its Cursor on Target (CoT) protocol. Typically bearer-agnostic — cellular, satellite, or tactical mesh radio (e.g. Persistent Systems Wave Relay, Silvus-class MANET radios) rather than consumer Wi-Fi. Included as a plausible modern complement to the doctrinal voice radio net above. IMPORTANT: no source found this session documents ATAK specifically being used for CDS/airdrop drop-zone coordination in official Air Force materiel — this System is representative/illustrative only, not a doctrinally confirmed capability for this mission type.",
    "commsLink": {
      "mode": "Digital",
      "medium": "cellular, satellite, or tactical mesh radio (MANET) — e.g. Persistent Systems Wave Relay- or Silvus-class radios; not consumer Wi-Fi",
      "protocol": "Cursor on Target (CoT), typically transported over UDP or TCP",
      "format": "CoT XML event schema (point/position, marker, and zone data)"
    },
    "doctrineSource": [
      {
        "publication": "Android Team Awareness Kit (ATAK) — general program information",
        "note": "ATAK's existence, DoD adoption (~40,000 DoD users per public sources), AFRL origin, and Cursor on Target (CoT) data protocol are confirmed via multiple corroborating public/unclassified sources as of 2026-09-07 (Wikipedia, DHS media library, civtak.org, and DTIC technical report ADA617401, 'Improving Situation Awareness with the Android Team Awareness Kit'). Its application to CDS/airdrop drop-zone coordination specifically is NOT confirmed by any source found this session — modeled here as a plausible representative capability only, per the user's own question about whether this technology applies, not as a verified doctrinal fact. The commsLink protocol/format (CoT XML over UDP/TCP) and bearer options are the confirmed, general ATAK/CoT facts; their application to this specific drop-zone link is the same representative/illustrative caveat as the rest of this record."
      }
    ]
  },
  {
    "id": "identity-access-control-system",
    "name": "Identity and Access Control System (representative)",
    "type": "SecurityAccessControl",
    "description": "Represents the identity/credential/access-control function personnel authenticate against to use mission-relevant systems (e.g. communications, mission planning/tasking data). Deliberately generic — modeled on the general DoD ICAM (Identity, Credential, and Access Management) policy concept, not any specific real fielded system.",
    "commsLink": {
      "mode": "Digital",
      "medium": "DoD enterprise network (representative — a NIPRNet/SIPRNet-class network is the real-world analogue, not modeled specifically)",
      "protocol": "PKI/CAC (Common Access Card) certificate-based authentication — the standard, publicly documented DoD ICAM mechanism",
      "format": "authentication transaction (representative — no specific real system's message format is modeled)"
    },
    "doctrineSource": [
      {
        "publication": "DoDI 8520.04, Access Management for DoD Information Systems",
        "note": "Confirmed as a real, public, unclassified DoD instruction governing access management for DoD information systems via web search on 2026-09-07; the primary-source PDF (esd.whs.mil) could not be directly fetched from this session's environment (network-level 403). Cited for the general ICAM policy concept only — this System record does not represent any specific real system's implementation. PKI/CAC as the standard DoD authentication mechanism is a well-documented, unclassified, publicly discussable fact (DoD Common Access Card program) added to commsLink.protocol for the same general-concept reason, not a new specific-system claim."
      }
    ]
  },
  {
    "id": "aircraft-intercom-system",
    "name": "Aircraft Intercommunication System (ICS, representative)",
    "type": "Communications",
    "description": "Represents the wired, point-to-point voice intercom connecting flight-deck and cargo-compartment crew positions aboard the tasked aircraft — the channel the Aircraft Commander and Loadmaster (and, on Mission 3, the Flight Nurse/Medical Crew Director) actually use for in-flight verbal coordination, as distinct from the aircraft's external voice radio nets (tactical-communications-system, dz-safety-of-flight-radio-net) used to talk to ATC and ground personnel. Deliberately generic — no specific real aircraft's intercom system, panel, or crypto detail is modeled, consistent with the classification boundary (AGENTS.md Section 3).",
    "commsLink": {
      "mode": "Verbal",
      "medium": "wired aircraft intercom (analog, point-to-point voice between crew stations)"
    },
    "doctrineSource": [
      {
        "publication": "General multi-crew military aircraft equipment concept",